{"C0_usr":0.49135072057990814,"C1_usr":0.059576473311033412,"ambient_mesh":"reference-shadow","boundary_beta":1,"build_hash":"release-e1-S-k16-resource-pilot-not-paper-result","c_H":0.5,"case":"S","ell0":2,"ell_max":6,"git_commit":"WORKTREE","initial_coarse_level":6,"kernel_riesz_solver":"saddle_point","manuscript_sha256":"03d83e0eb7128aa5ef00002c6dac110f548351e52e92e56d7adf709880854d20","method":"PALOD","patch_solver_kind":"direct_saddle","petrov_mode":"two_sided","quadrature":{"base_triangle_order":7,"gaussian_triangle_order":10,"max_recursive_subdivisions":4,"singular_triangle_order":10},"reference_epoch":0,"reference_level":10,"reference_mesh":"uniform-nvb","relative_energy_targets":[0.10000000000000001,0.050000000000000003,0.02,0.01],"repeat_index":0,"rho_star":0.25,"schema_version":2,"theta_H":0.5,"theta_loc":0.19985934547160381,"timing_repeats":1,"tolerances":{"eigen_relative_residual":1e-10,"interpolation_right_inverse":1.0000000000000001e-09,"linear_relative_residual":1e-10,"prolongation_composition":1e-10},"wavenumber":16,"work_limits":{"maximum_H_steps":2,"maximum_ambient_elements":500000,"maximum_coarse_elements":50000,"maximum_iterations":20,"maximum_unknowns":500000,"maximum_wall_seconds":1800}}
