{"C0_usr":1e-06,"C1_usr":1e-06,"ambient_mesh":"reference-shadow","boundary_beta":1,"build_hash":"sha256:39c3a5d991a4923ddd0f314ab125df399bd039d9d4983ddd034fc6ac52cb52c2","c_H":100,"case":"R1","ell0":2,"ell_max":2,"git_commit":"4002a084cf242716e2fb7fae378016918fa63610","initial_coarse_level":4,"kernel_riesz_solver":"saddle_point","manuscript_sha256":"03d83e0eb7128aa5ef00002c6dac110f548351e52e92e56d7adf709880854d20","method":"HLOD-fixed","patch_solver_kind":"direct_saddle","petrov_mode":"two_sided","quadrature":{"base_triangle_order":7,"gaussian_triangle_order":10,"max_recursive_subdivisions":4,"singular_triangle_order":10},"reference_epoch":0,"reference_level":6,"reference_mesh":"uniform-nvb","relative_energy_targets":[0.1,0.05,0.02,0.01],"repeat_index":0,"rho_star":0.25,"schema_version":2,"theta_H":0.5,"theta_loc":0.1998593454716038,"timing_repeats":1,"tolerances":{"eigen_relative_residual":1e-10,"interpolation_right_inverse":1e-09,"linear_relative_residual":1e-10,"prolongation_composition":1e-10},"wavenumber":8,"work_limits":{"maximum_H_steps":2,"maximum_ambient_elements":100000,"maximum_coarse_elements":10000,"maximum_iterations":20,"maximum_unknowns":100000,"maximum_wall_seconds":30}}
